#type; TCON_TV; TV Output
#regdef; TV_GCTL_REG; 0x0000; TV Global Control Register
#regdef; TV_GINT0_REG; 0x0004; TV Global Interrupt Register0
#regdef; TV_GINT1_REG; 0x0008; TV Global Interrupt Register1
#regdef; TV_GINT2_REG; 0x000C; TV Global Interrupt Register1
#regdef; TV_SRC_CTL_REG; 0x0040; TV Source Control Register
#regdef; TV_IO_POL_REG; 0x0088; TV IO Polarity Register
#regdef; TV_IO_TRI_REG; 0x008C; TV IO Control Register
#regdef; TV_CTL_REG; 0x0090; TV Control Register
##regdef; TV_BASIC0_REG; 0x0094; TV Basic Timing Register0
#regdef; TV_BASIC1_REG; 0x0098; TV Basic Timing Register1
#regdef; TV_BASIC2_REG; 0x009C; TV Basic Timing Register2
#regdef; TV_BASIC3_REG; 0x00A0; TV Basic Timing Regi ster3
#regdef; TV_BASIC4_REG; 0x00A4; TV Basic Timing Register4
#regdef; TV_BASIC5_REG; 0x00A8; TV Basic Timing Register5
##regdef; TV_ECC_FIFO_REG; 0x00F8; TV ECC FIFO Register
#regdef; TV_DEBUG_REG; 0x00FC; TV Debug Register
#regdef; TV_CEU_CTL_REG; 0x0100; TV CEU Control Register
#aggreg; TCON_CEU_COEF; 0x110 3; TCON CEU coefficient register1 (N=0,1,2)
#regdef; MUL_REG; 0x000 3; TCON CEU coefficient register0 (N=0,1,2, 4,5,6, 8,9,10)
##regdef; ADD_REG; 0x00C;  0x11C+N*0x10 TCON CEU coefficient register1 (N=0,1,2)
#regdef; pad 0; 0x010
#aggregend;
#regdef; TV_CEU_COEF_RANG_REG; 0x0140 3; TV CEU Coefficient Range R egister (N=0,1,2)
#regdef; TV_SAFE_PERIOD0_REG; 0x01F0; TV Safe Period0 Register
#regdef; TV_SAFE_PERIOD1_REG; 0x01F4; TV Safe Period1 Register
#regdef; tcon_mul_ctl; 0x0200; https://github.com/qiaoweibiao/T507_Kernel/blob/98fcc7d3f112e51b0edfb71536da89cb2115106f/drivers/video/fbdev/sunxi/disp2/disp/de/lowlevel_sun50iw1/de_lcd_type.h#L691
#regdef; TV_FILL_CTL_REG; 0x0300; TV Fill Data Control Register

#aggreg; TV_FILL; 0x0304 3; V Fill Data 0..2
#regdef; TV_FILL_BEGIN_REG; 0x00; TV Fill Data Begin Register 0x0304+N*0x0C(N=0..2)
#regdef; TV_FILL_END_REG; 0x04; TV Fill Data End Register  0x0308+N*0x0C(N=0..2)
#regdef; TV_FILL_DATA_REG; 0x08; TV Fill Data Value Register  0x030C+N*0x0C(N=0..2)
#aggregend;

#regdef; TV_FILL_DATAH1; 0x0328; TV Fill Data High1 Value Register
#regdef; TV_FILL_DATAH2; 0x032C; TV Fill Data High2 Value Register
#regdef; TV_DATA_IO_POL0_REG; 0x0330; TV Data IO Polarity Control0 Register
#regdef; TV_DATA_IO_POL1_REG; 0x0334; TV Data IO Polarity Control1 Register
#regdef; TV_DATA_IO_TRI0_REG; 0x0338; TV Data IO Enable Control0 Register
#regdef; TV_DATA_IO_TRI1_REG; 0x033C; TV Data IO Enable Control1 Register
#regdef; TV_PIXELDEPTH_MODE_REG; 0x0340; TV Pixeldepth Mode Control Register

#regdefr; padding 0; 0x01000; set size
#typeend;
