#comment; Serial Peripheral Interface
#type; SPI_DBI
#base; SPI_DBI 0x04026000
#irqrv; SPI1 32
#irq; SPI1 48
#regdef; SPI_GCR; 0x0004; SPI Global Control Register
#regdef; SPI_TCR; 0x0008; SPI Transfer Control Register
#regdef; SPI_IER; 0x0010; SPI Interrupt Control Register
#regdef; SPI_ISR; 0x0014; SPI Interrupt Status Register
#regdef; SPI_FCR; 0x0018; SPI FIFO Control Register
#regdef; SPI_FSR; 0x001C; SPI FIFO Status Register
#regdef; SPI_WCR; 0x0020; SPI Wait Clock Register
#regdef; SPI_SAMP_DL; 0x0028; SPI Sample Delay Control Register
#regdef; SPI_MBC; 0x0030; SPI Master Burst Counter Register
#regdef; SPI_MTC; 0x0034; SPI Master Transmit Counter Register
#regdef; SPI_BCC; 0x0038; SPI Master Burst Control Register
#regdef; SPI_BATCR; 0x0040; SPI Bit-Aligned Transfer Configure Register
#regdef; SPI_BA_CCR; 0x0044; SPI Bit-Aligned Clock Configuration Register
#regdef; SPI_TBR; 0x0048; SPI TX Bit Register
#regdef; SPI_RBR; 0x004C; SPI RX Bit Register
#regdef; SPI_NDMA_MODE_CTL; 0x0088; SPI Normal DMA Mode Control Register
#regdef; DBI_CTL_0; 0x0100; DBI Control Register 0
#regdef; DBI_CTL_1; 0x0104; DBI Control Register 1
#regdef; DBI_CTL_2; 0x0108; DBI Control Register 2
#regdef; DBI_TIMER; 0x010C; DBI Timer Control Register
#regdef; DBI_VIDEO_SZIE; 0x0110; DBI Video Size Configuration Register
#regdef; DBI_INT; 0x0120; DBI Interrupt Register
#regdef; DBI_DEBUG_0; 0x0124; DBI BEBUG 0 Register
#regdef; DBI_DEBUG_1; 0x0128; DBI BEBUG 1 Register
#regdef; SPI_TXD; 0x0200; SPI TX Data register
#regdef; SPI_RXD; 0x0300; SPI RX Data register
