#type; I2S; Контроллер I2S предназначен для обмена аудио-данными в стерео-формате по последовательной шине I2S.

#base; I2S0 0x38030000

#irq; I2S0 104; Прерывание от I2S0

#regdef; IER; 	0x000; Регистр включения контроллера. W/R 0x0 0x0
#regdef; IRER;	0x004; Регистр включения блока приема. W/R 0x0 0x4
#regdef; ITER; 	0x008; Регистр включения блока передачи. W/R 0x0 0x8
#regdef; CER; 	0x00c; Регистр включения тактовой частоты. W/R 0x0 0xC
#regdef; CCR; 	0x010; Регистр конфигурации тактовой частоты. W/R 0x10 0x10
#regdef; RXFFR; 0x014; Регистр сброса FIFO буферов блока приема. W 0x0 0x14
#regdef; TXFFR; 0x018; Регистр сброса FIFO буферов блока передачи. W 0x0 0x18
#regdef; LRBR0_LTHR0; 0x020; Регистр «левого» слова приемника. R 0x0 0x20, Регистр «левого» слова нулевого передатчика. W 0x0 0x20
#regdef; RRBR0; 0x024; Регистр «правого» слова приемника. R 0x0 0x24, Регистр «правого» слова нулевого передатчика. W 0x0 0x24
#regdef; RER0; 	0x028; Регистр включения приемника. W/R 0x1 0x28
#regdef; TER0; 	0x02c; Регистр включения нулевого передатчика. W/R 0x1 0x2C
#regdef; RCR0; 	0x030; Регистр конфигурации приемника. W/R 0x5 0x30
#regdef; TCR0; 	0x034; Регистр конфигурации нулевого передатчика. W/R 0x5 0x34
#regdef; ISR0; 	0x038; Регистр статуса прерывания нулевого канала. R 0x10 0x38
#regdef; IMR0; 	0x03C; Регистр маски прерывания нулевого канала. W/R 0x33 0x3C
#regdef; ROR0; 	0x040; Регистр переполнения FIFO приемника. R 0x0 0x40
#regdef; TOR0; 	0x044; Регистр переполнения FIFO нулевого передатчика. R 0x0 0x44
#regdef; RFCR0; 0x048; Регистр конфигурации FIFO приемника. W/R 0x3 0x48
#regdef; TFCR0; 0x04C; Регистр конфигурации FIFO нулевого передатчика. W/R 0x3 0x4C
#regdef; RFF0; 	0x050; Регистр сброса FIFO приемника. W 0x0 0x50
#regdef; TFF0; 	0x054; Регистр сброса FIFO нулевого передатчика. W 0x0 0x54
#regdef; LTHR1; 0x060; Регистр «левого» слова первого передатчика. W 0x0 0x60
#regdef; RTHR1; 0x064; Регистр «правого» слова первого передатчика. W 0x0 0x64
#regdef; TER1; 	0x06c; Регистр включения первого передатчика W/R 0x1 0x6C
#regdef; TCR1; 	0x074; Регистр конфигурации первого передатчика. W/R 0x5 0x74
#regdef; ISR1; 	0x078; Регистр статуса прерывания первого канала. R 0x10 0x78
#regdef; IMR1; 	0x07c; Регистр маски прерывания первого канала. W/R 0x33 0x7C
#regdef; TOR1; 	0x084; Регистр переполнения первого передатчика. R 0x0 0x84
#regdef; TFCR1; 0x08c; Регистр конфигурации FIFO первого передатчика. W/R 0x3 0x8C
#regdef; TFF1; 	0x094; Регистр сброса FIFO первого передатчика. W 0x0 0x94
#regdef; LTHR2; 0x0a0; Регистр «левого» слова второго передатчика. W 0x0 0xA0
#regdef; RTHR2; 0x0a4; Регистр «правого» слова второго передатчика. W 0x0 0xA4
#regdef; TER2; 	0x0ac; Регистр включения второго передатчика W/R 0x1 0xAC
#regdef; TCR2; 	0x0b4; Регистр конфигурации второго передатчика. W/R 0x5 0xB4
#regdef; ISR2; 	0x0b8; Регистр статуса прерывания второго канала. R 0x10 0xB8
#regdef; IMR2; 	0x0bc; Регистр маски прерывания второго канала. W/R 0x33 0xBC
#regdef; TOR2; 	0x0c4; Регистр переполнения второго передатчика. R 0x0 0xC4
#regdef; TFCR2; 0x0cc; Регистр конфигурации FIFO второго передатчика. W/R 0x3 0xCC
#regdef; TFF2; 	0x0d4; Регистр сброса FIFO второго передатчика. W 0x0 0xD4
#regdef; LTHR3; 0x0e0; Регистр «левого» слова третьего передатчика. W 0x0 0xE0
#regdef; RTHR3; 0x0e4; Регистр «правого» слова третьего передатчика. W 0x0 0xE4
#regdef; TER3; 	0x0ec; Регистр включения третьего передатчика W/R 0x1 0xEC
#regdef; TCR3; 	0x0f4; Регистр конфигурации третьего передатчика. W/R 0x5 0xF4
#regdef; ISR3; 	0x0f8; Регистр статуса прерывания третьего канала. R 0x10 0xF8
#regdef; IMR3; 	0x0fc; Регистр маски прерывания третьего канала. W/R 0x33 0xFC
#regdef; TOR3; 	0x104; Регистр переполнения третьего передатчика. R 0x0 0x104
#regdef; TFCR3; 0x10c; Регистр конфигурации FIFO третьего передатчика. W/R 0x3 0x10C
#regdef; TFF3; 	0x114; Регистр сброса FIFO третьего передатчика. W 0x0 0x114
#regdef; RXDMA; 0x1C0; Регистр DMA приема. R 0x0 0x1C0
#regdef; TXDMA; 0x1C8; Регистр DMA передачи. W 0x0 0x1C8
#regdef; RTXDMA; 0x1CC; Регистр сброса DMA передачи. W 0x0 0x1CC
#regdef; I2S_COMP_PARAM_2; 0x1F0; Второй регистр параметров компонента. R 0x48c 0x1F0
#regdef; I2S_COMP_PARAM_1; 0x1F4; Первый регистр параметров компонента. R 0x24c067e 0x1F4
#regdef; I2S_COMP_VERSION; 0x1F8; Регистр ревизии компонента. R 0x3130362a 0x1F8
#regdef; I2S_COMP_TYPE; 0x1FC; Регистр типа компонента. R 0x445701a0 0x1FC

#typeend;
